system,body,type,subType,temp,radius,absMagnitude,solMass,spectralClass,luminosity
Thuecheae YP-E c28-26,Thuecheae YP-E c28-26,Star,K (Yellow-Orange) Star,4987,5.707153,0.8963927419122933,0.804688,K1,Va
Byeia Eurk AK-X b44-4,Byeia Eurk AK-X b44-4 A,Star,M (Red dwarf) Star,2903,9.248871,0.517974820992092,0.328125,M4,Va
Byeia Eurk AK-X b44-4,Byeia Eurk AK-X b44-4 B,Star,L (Brown dwarf) Star,1390,14.173203,0.23406978576563622,0.113281,L8,V
Byeia Eurk AK-X b44-4,Byeia Eurk AK-X b44-4 C,Star,L (Brown dwarf) Star,1997,11.887085,0.3248901107117182,0.191406,L0,V
Bleae Briae HQ-G d10-16,Bleae Briae HQ-G d10-16,Star,G (White-Yellow) Star,5407,4.832001,1.1408996117900791,1.070313,G7,Vz
Swuenaa HH-S d5-69,Swuenaa HH-S d5-69 A,Star,F (White) Star,6246,4.382126,1.0517272293314162,1.257813,F8,Vb
Swuenaa HH-S d5-69,Swuenaa HH-S d5-69 B,Star,M (Red dwarf) Star,2982,9.029388,0.5430907951114307,0.328125,M4,Va
Swuenaa HH-S d5-69,Swuenaa HH-S d5-69 C,Star,F (White) Star,6122,4.465485,1.0535583378864126,1.160156,F9,Vb
Skaude AG-O b51-1,Skaude AG-O b51-1 A,Star,M (Red dwarf) Star,2564,10.136459,0.44125363623292596,0.269531,M6,Va
Skaude AG-O b51-1,Skaude AG-O b51-1 B,Star,L (Brown dwarf) Star,1397,14.005478,0.2503356779295471,0.117188,L8,V
Skaude AG-O b51-1,Skaude AG-O b51-1 C,Star,M (Red dwarf) Star,2014,11.528091,0.37683103378864125,0.191406,M9,VI
Skaude AG-O b51-1,Skaude AG-O b51-1 D,Star,T (Brown dwarf) Star,1230,14.957336,0.2083434881380302,0.09375,T1,V
Nyauthou CF-D c1-12,Nyauthou CF-D c1-12 A,Star,K (Yellow-Orange) Star,4855,5.763947,0.9213866053199137,0.789063,K2,Va
Nyauthou CF-D c1-12,Nyauthou CF-D c1-12 B,Star,M (Red dwarf) Star,2493,10.349716,0.42309567217828903,0.292969,M7,Va
Truechoae RI-Z c27-7,Truechoae RI-Z c27-7,Star,K (Yellow-Orange) Star,4547,6.37735,0.7919921322789361,0.703125,K4,Va
Blaa Phoe GM-M c23-234,Blaa Phoe GM-M c23-234 A,Star,K (Yellow-Orange) Star,5108,5.40506,0.9819335499640547,0.863281,K0,Va
Blaa Phoe GM-M c23-234,Blaa Phoe GM-M c23-234 B,Star,M (Red dwarf) Star,3409,7.921326,0.6921386513299784,0.476563,M1,Va
Joothee OM-V b3-32,Joothee OM-V b3-32,Star,M (Red dwarf) Star,2588,10.221527,0.4164733515456506,0.289063,M6,Va
Qaugneau TP-G d10-15,Qaugneau TP-G d10-15,Star,F (White) Star,6995,3.586029,1.209808333572969,1.492188,F3,Vb
Hegoea XJ-D b27-1,Hegoea XJ-D b27-1,Star,M (Red dwarf) Star,2312,10.625122,0.4333495672178289,0.226563,M8,Va
Qiedeae NX-K d8-0,Qiedeae NX-K d8-0 A,Star,A (Blue-White) Star,8466,2.3983,1.4270018806613947,1.707031,A6,Vb
Qiedeae NX-K d8-0,Qiedeae NX-K d8-0 B,Star,K (Yellow-Orange) Star,5037,5.826767,0.8316039453630482,0.820313,K1,Vab
Shrogaae HN-B d13-2920,Shrogaae HN-B d13-2920 A,Star,F (White) Star,6052,4.476089,1.0728149302659957,1.078125,F9,Vb
Shrogaae HN-B d13-2920,Shrogaae HN-B d13-2920 B,Star,K (Yellow-Orange) Star,4200,6.613327,0.8327025736879943,0.65625,K6,Va
Shrogaae HN-B d13-2920,Shrogaae HN-B d13-2920 C,Star,M (Red dwarf) Star,2646,9.948212,0.4518432207045291,0.257813,M6,Va
Puwaae DS-W c1-0,Puwaae DS-W c1-0 A,Star,K (Yellow-Orange) Star,4458,6.345947,0.8359374493170381,0.703125,K4,Va
Puwaae DS-W c1-0,Puwaae DS-W c1-0 B,Star,K (Yellow-Orange) Star,3725,8.030258,0.551330553558591,0.4375,K9,Va
Puwaae DS-W c1-0,Puwaae DS-W c1-0 C,Star,M (Red dwarf) Star,2934,9.315659,0.49172971387491016,0.339844,M4,Va
Sutchooe WO-Z d13-38,Sutchooe WO-Z d13-38 A,Star,F (White) Star,6044,4.751862,0.9474181797268152,1.082031,F9,VI
Sutchooe WO-Z d13-38,Sutchooe WO-Z d13-38 B,Star,M (Red dwarf) Star,3236,8.416687,0.61148066139468,0.417969,M2,Va
Eafotls JU-I c9-0,Eafotls JU-I c9-0 A,Star,M (Red dwarf) Star,3503,7.933807,0.6517333486700215,0.503906,M1,Va
Eafotls JU-I c9-0,Eafotls JU-I c9-0 B,Star,M (Red dwarf) Star,2133,11.195374,0.3915710481667865,0.203125,M9,VI
Eafotls JU-I c9-0,Eafotls JU-I c9-0 C,Star,T (Brown dwarf) Star,876,17.136124,0.15063474335010785,0.050781,T7,V
Reangu FL-W d2-6,Reangu FL-W d2-6 A,Star,F (White) Star,7241,3.525467,1.1609190510424154,1.417969,F1,VI
Reangu FL-W d2-6,Reangu FL-W d2-6 B,Star,G (White-Yellow) Star,5324,5.452057,0.8845214090582315,0.757813,G8,Vab
Prua Hypa MW-N d6-0,Prua Hypa MW-N d6-0 A,Star,Neutron Star,6045254,5.046799,1.8495012580877066e-05,0.480469,None,VII
Prua Hypa MW-N d6-0,Prua Hypa MW-N d6-0 B,Star,M (Red dwarf) Star,2669,9.80162,0.4750976276060388,0.277344,M6,Va
Nyauthou YY-E c10,Nyauthou YY-E c10,Star,K (Yellow-Orange) Star,3726,7.853409,0.5977782659956865,0.503906,K9,Va
Striechae NA-C d14-20,Striechae NA-C d14-20,Star,A (Blue-White) Star,8206,2.743118,1.2958983177570094,1.710938,A7,VI
Striechae NA-C d14-20,Striechae NA-C d14-20 1,Star,Y (Brown dwarf) Star,411,22.308426,0.07748412365204889,0.015625,Y4,V
Pyrivo RT-C b5-2,Pyrivo RT-C b5-2,Star,M (Red dwarf) Star,2171,10.89679,0.43368530265995686,0.226563,M8,Va
Gru Hypue PD-S d4-37,Gru Hypue PD-S d4-37,Star,G (White-Yellow) Star,5946,4.660873,1.020751873472322,1.027344,G0,Vb
Bleae Thua PZ-A b41-2,Bleae Thua PZ-A b41-2,Star,M (Red dwarf) Star,3662,7.928452,0.5978393213515456,0.421875,M0,Va
Pyuefoea PE-B b4-1,Pyuefoea PE-B b4-1 A,Star,M (Red dwarf) Star,3255,8.623734,0.5494079309849029,0.425781,M2,Va
Pyuefoea PE-B b4-1,Pyuefoea PE-B b4-1 B,Star,M (Red dwarf) Star,2573,9.985565,0.469696,0.261719,M6,Va
Gria Gree AQ-R b10-0,Gria Gree AQ-R b10-0,Star,M (Red dwarf) Star,3114,8.44281,0.65243527821711,0.445313,M3,Va
Hegoo SY-I d9-0,Hegoo SY-I d9-0,Star,G (White-Yellow) Star,5741,4.884445,0.9878844917325665,0.902344,G3,Vab
Pyria Thua UO-I d9-1,Pyria Thua UO-I d9-1 A,Star,F (White) Star,7159,3.406189,1.254730168224299,1.4375,F2,Vb
Pyria Thua UO-I d9-1,Pyria Thua UO-I d9-1 B,Star,K (Yellow-Orange) Star,4249,6.85379,0.7283324687275341,0.546875,K6,Va
Pyria Thua UO-I d9-1,Pyria Thua UO-I d9-1 C,Star,M (Red dwarf) Star,2181,11.048843,0.40066525952552123,0.199219,M8,Va
Seagull Sector VD-T b3-0,Seagull Sector VD-T b3-0 A,Star,T Tauri Star,2224,10.526093,0.4901733314162473,0.285156,TTS8,Va
Seagull Sector VD-T b3-0,Seagull Sector VD-T b3-0 B,Star,T Tauri Star,1339,14.404953,0.22671507692307694,0.082031,TTS9,VI
Truechoae WY-S b3-13,Truechoae WY-S b3-13 A,Star,M (Red dwarf) Star,3352,8.483307,0.552673311286844,0.441406,M2,Va
Truechoae WY-S b3-13,Truechoae WY-S b3-13 B,Star,M (Red dwarf) Star,2493,10.35379,0.422302228612509,0.28125,M7,Va
Truechoae WY-S b3-13,Truechoae WY-S b3-13 C,Star,M (Red dwarf) Star,2520,9.952011,0.49728391085549967,0.308594,M6,Va
Truechoae WY-S b3-13,Truechoae WY-S b3-13 D,Star,L (Brown dwarf) Star,1660,13.008224,0.28060910424155283,0.136719,L4,V
Hegeia ZP-G d10-7,Hegeia ZP-G d10-7,Star,F (White) Star,7141,3.147354,1.4206541480948958,1.667969,F2,Vab
Pyuefoea WI-O c8-1,Pyuefoea WI-O c8-1,Star,K (Yellow-Orange) Star,3891,7.507919,0.6426696879942487,0.503906,K8,Va
Eoch Flyi AA-A h46,Eoch Flyi AA-A h46 A,Star,Wolf-Rayet O Star,55403,-9.170013,6.852019807332854,106.601563,None,I
Eoch Flyi AA-A h46,Eoch Flyi AA-A h46 B,Star,Wolf-Rayet C Star,3418,3.222061,5.991485469446442,54.117188,None,I
Eoch Flyi AA-A h46,Eoch Flyi AA-A h46 C,Star,B (Blue-White) Star,32976,-14.535889,228.7729604370956,51.066406,B0,IVa
Blae Drye NU-R b10-2,Blae Drye NU-R b10-2,Star,M (Red dwarf) Star,3430,8.396622,0.5493163709561466,0.4375,M1,Va
Gria Gree UF-L d9-0,Gria Gree UF-L d9-0 A,Star,F (White) Star,6829,3.661728,1.2258605089863408,1.59375,F4,Vb
Gria Gree UF-L d9-0,Gria Gree UF-L d9-0 B,Star,K (Yellow-Orange) Star,5136,5.393768,0.976318297627606,0.933594,K0,Va
Segne HH-S d5-37,Segne HH-S d5-37,Star,K (Yellow-Orange) Star,5105,5.384857,0.9922790050323508,0.8125,K0,Va
Byua Chrea OA-A d124,Byua Chrea OA-A d124,Star,L (Brown dwarf) Star,1597,13.199585,0.27761840402588067,0.132813,L5,V
Thuechu DE-S b10-4,Thuechu DE-S b10-4,Star,M (Red dwarf) Star,2495,10.082352,0.4777526383896477,0.308594,M7,Va
Ploi Thua TU-X c14-7,Ploi Thua TU-X c14-7 A,Star,K (Yellow-Orange) Star,3833,7.429306,0.6866759683680805,0.605469,K9,Va
Ploi Thua TU-X c14-7,Ploi Thua TU-X c14-7 B,Star,M (Red dwarf) Star,2591,10.164429,0.42657467721063985,0.261719,M6,Va
Stuelou ZN-D c27-70,Stuelou ZN-D c27-70,Star,K (Yellow-Orange) Star,4371,6.957672,0.6560973572969087,0.574219,K5,Vab
Blu Thua IM-U b33-0,Blu Thua IM-U b33-0,Star,M (Red dwarf) Star,2893,9.18779,0.5364379698058951,0.324219,M4,Va
Cryaft KB-X d1-3,Cryaft KB-X d1-3 A,Star,A (Blue-White) Star,7519,2.88089,1.448669308411215,1.632813,A9,Vb
Cryaft KB-X d1-3,Cryaft KB-X d1-3 B,Star,G (White-Yellow) Star,5296,5.675232,0.8066100819554277,0.785156,G8,Vab
Cryaft KB-X d1-3,Cryaft KB-X d1-3 C,Star,G (White-Yellow) Star,5209,5.488174,0.908782884255931,0.808594,G9,Vab
Smootoae XU-I b50-16,Smootoae XU-I b50-16 A,Star,M (Red dwarf) Star,2418,10.43927,0.4315795600287563,0.285156,M7,Va
Smootoae XU-I b50-16,Smootoae XU-I b50-16 B,Star,L (Brown dwarf) Star,1660,13.20256,0.2565917814521927,0.117188,L4,V
Oochost YY-S b23-0,Oochost YY-S b23-0 A,Star,M (Red dwarf) Star,3277,8.497742,0.5744322990654206,0.402344,M2,Va
Oochost YY-S b23-0,Oochost YY-S b23-0 B,Star,M (Red dwarf) Star,2036,11.49324,0.37469480948957584,0.179688,M9,VI
Theema WR-A d14-841,Theema WR-A d14-841,Star,F (White) Star,7097,3.598618,1.1684874306254494,1.214844,F2,VI
Stuemeae SO-Z c3138,Stuemeae SO-Z c3138,Star,K (Yellow-Orange) Star,4491,6.465271,0.7796629992810927,0.679688,K4,
Plaa Briae HU-K b8-0,Plaa Briae HU-K b8-0 A,Star,M (Red dwarf) Star,2418,10.258698,0.4689941164629763,0.273438,M7,Va
Plaa Briae HU-K b8-0,Plaa Briae HU-K b8-0 B,Star,L (Brown dwarf) Star,1788,12.353683,0.32693477498202733,0.175781,L3,V
Truechou BA-A d153,Truechou BA-A d153,Star,F (White) Star,6522,4.06665,1.1153869388928828,1.101563,F6,Vb
Blua Eaec NA-D d13-971,Blua Eaec NA-D d13-971 A,Star,F (White) Star,7206,3.43399,1.2226560920201295,1.605469,F1,VI
Blua Eaec NA-D d13-971,Blua Eaec NA-D d13-971 B,Star,K (Yellow-Orange) Star,4911,5.733002,0.9134216189791516,0.894531,K1,Va
Blua Eaec NA-D d13-971,Blua Eaec NA-D d13-971 C,Star,K (Yellow-Orange) Star,4160,6.996399,0.7115477670740474,0.546875,K6,Va
Blua Eaec NA-D d13-971,Blua Eaec NA-D d13-971 D,Star,K (Yellow-Orange) Star,4942,6.025192,0.7884521179007908,0.6875,K1,Vab
Sutchae CO-D b12-3,Sutchae CO-D b12-3 A,Star,M (Red dwarf) Star,2225,10.908478,0.41067502516175414,0.226563,M8,Va
Sutchae CO-D b12-3,Sutchae CO-D b12-3 B,Star,L (Brown dwarf) Star,1906,12.042267,0.3320617455068296,0.167969,L1,V
Sutchae CO-D b12-3,Sutchae CO-D b12-3 C,Star,L (Brown dwarf) Star,1610,13.418091,0.2470092652767793,0.113281,L5,V
Sutchae CO-D b12-3,Sutchae CO-D b12-3 D,Star,M (Red dwarf) Star,2004,11.701813,0.35134884255930987,0.207031,M9,VI
Pyra Dryiae YB-K c25-1,Pyra Dryiae YB-K c25-1 A,Star,K (Yellow-Orange) Star,4221,6.901901,0.7218627634795112,0.675781,K6,Va
Pyra Dryiae YB-K c25-1,Pyra Dryiae YB-K c25-1 B,Star,L (Brown dwarf) Star,1919,11.679855,0.38705442415528396,0.191406,L1,V
Segne EB-Q c8-2,Segne EB-Q c8-2,Star,K (Yellow-Orange) Star,3916,7.544037,0.6240233731128685,0.554688,K8,Va
Byoomao LS-S c20-5214,Byoomao LS-S c20-5214 A,Star,K (Yellow-Orange) Star,4756,6.173035,0.7953185679367362,0.664063,K2,Vab
Byoomao LS-S c20-5214,Byoomao LS-S c20-5214 B,Star,M (Red dwarf) Star,2916,9.285065,0.5048827951114306,0.289063,M4,Va
Swoiwns XF-M d8-4,Swoiwns XF-M d8-4,Star,A (Blue-White) Star,8144,2.659317,1.3674620043134436,1.636719,A7,Vb
Stuelou DR-A c15-67,Stuelou DR-A c15-67,Star,K (Yellow-Orange) Star,4916,5.89769,0.8450011560028756,0.863281,K1,Vab
Smootoae CP-M b48-13,Smootoae CP-M b48-13,Star,M (Red dwarf) Star,2800,9.727707,0.4466247591660676,0.285156,M5,Va
Prae Flyi GC-B d14-153,Prae Flyi GC-B d14-153 A,Star,L (Brown dwarf) Star,1758,12.735794,0.2836303551401869,0.152344,L3,V
Pyrivo ZV-C d131,Pyrivo ZV-C d131,Star,A (Blue-White) Star,7740,2.973831,1.3098448885693745,1.402344,A9,Vb
Cheae Euq PD-K d8-0,Cheae Euq PD-K d8-0 A,Star,F (White) Star,6260,4.575455,0.9578857455068296,1,F8,Vb
Cheae Euq PD-K d8-0,Cheae Euq PD-K d8-0 B,Star,M (Red dwarf) Star,3107,8.617935,0.6046142113587347,0.398438,M3,Va
Cheae Euq PD-K d8-0,Cheae Euq PD-K d8-0 C,Star,T (Brown dwarf) Star,1058,15.572586,0.2121276779295471,0.078125,T4,V
Gru Hypai PO-O d7-374,Gru Hypai PO-O d7-374 A,Star,F (White) Star,6314,4.448044,0.9984740762041696,1.039063,F7,VI
Bleae Briae ZC-W b15-8,Bleae Briae ZC-W b15-8,Star,M (Red dwarf) Star,3374,8.56662,0.5249633817397555,0.386719,M1,Va
Nyuena QY-A e284,Nyuena QY-A e284,Star,T Tauri Star,4265,6.67894,0.7834776937455068,0.59375,TTS6,Va
Bleae Briae JR-N d6-3,Bleae Briae JR-N d6-3,Star,K (Yellow-Orange) Star,5009,5.462387,0.9945372710280374,0.902344,K1,Va
Byoomao GN-N c9-4667,Byoomao GN-N c9-4667 A,Star,K (Yellow-Orange) Star,4799,5.725418,0.9598998820992092,0.835938,K2,Va
Byoomao GN-N c9-4667,Byoomao GN-N c9-4667 B,Star,M (Red dwarf) Star,3636,7.835312,0.6329955197699497,0.503906,M0,Va
Byoomao GN-N c9-4667,Byoomao GN-N c9-4667 C,Star,M (Red dwarf) Star,3115,8.758163,0.5639037699496765,0.378906,M3,Va
Dryio Flyuae WQ-D b2,Dryio Flyuae WQ-D b2 A,Star,M (Red dwarf) Star,3255,8.975815,0.46719355859094175,0.347656,M2,Va
Dryio Flyuae WQ-D b2,Dryio Flyuae WQ-D b2 B,Star,M (Red dwarf) Star,2915,9.537903,0.44970701941049607,0.300781,M4,Va
Pyurks DK-G c27-6,Pyurks DK-G c27-6,Star,K (Yellow-Orange) Star,4301,6.795776,0.7300719712437096,0.691406,K5,Vab
Stuemeae RY-A d7619,Stuemeae RY-A d7619,Star,G (White-Yellow) Star,5845,4.926376,0.9348143666427031,1.0625,G1,Vb
Greae Hypai CH-S d5-427,Greae Hypai CH-S d5-427,Star,G (White-Yellow) Star,5803,4.96579,0.9313353616103522,1,G2,Vb
Thuechu GS-G b2-0,Thuechu GS-G b2-0 A,Star,M (Red dwarf) Star,2536,10.095871,0.4595641696621136,0.304688,M6,Va
Nyauthou ZA-P b25-0,Nyauthou ZA-P b25-0 A,Star,M (Red dwarf) Star,2236,11.009216,0.38821406182602447,0.230469,M8,Va
Nyauthou ZA-P b25-0,Nyauthou ZA-P b25-0 B,Star,L (Brown dwarf) Star,1958,12.143326,0.30035400143781454,0.160156,L0,V
Stuemeae ZQ-C d7147,Stuemeae ZQ-C d7147 A,Star,F (White) Star,6723,4.033524,1.065826369518332,1.109375,F5,Vb
Stuemeae ZQ-C d7147,Stuemeae ZQ-C d7147 B,Star,K (Yellow-Orange) Star,3744,7.84227,0.5950927505391804,0.460938,K9,Va
Gria Gree HN-V a84-1,Gria Gree HN-V a84-1,Star,T (Brown dwarf) Star,762,18.072769,0.11972044284687275,0.039063,T8,V
Bleae Thua NX-J b22-6,Bleae Thua NX-J b22-6,Star,M (Red dwarf) Star,3104,8.96022,0.5174560115025162,0.324219,M3,Va
Croomoi QT-R e4-660,Croomoi QT-R e4-660,Star,Neutron Star,2458639,5.110184,1.1182377785765637e-05,2.191406,None,VII
Croomoi QT-R e4-660,Croomoi QT-R e4-660 3,Star,Y (Brown dwarf) Star,422,21.569778,0.0695800718907261,0.015625,Y3,V
Dryaa Pri CX-F c911,Dryaa Pri CX-F c911 A,Star,K (Yellow-Orange) Star,4836,5.753799,0.9329833501078361,0.878906,K2,Va
Drootie WG-C c29-10,Drootie WG-C c29-10,Star,M (Red dwarf) Star,3652,7.718185,0.6622313731128684,0.5,M0,Va
Bleae Briae AY-P b46-0,Bleae Briae AY-P b46-0,Star,M (Red dwarf) Star,3160,8.679703,0.568115209202013,0.371094,M3,Va
Clookuia JY-T c19-8,Clookuia JY-T c19-8 A,Star,G (White-Yellow) Star,5278,5.609222,0.8371886470165348,0.789063,G9,Vab
Slegi IL-F c14-1,Slegi IL-F c14-1,Star,K (Yellow-Orange) Star,4347,6.639862,0.7678832724658519,0.730469,K5,Va
Hegoea LC-H b25-2,Hegoea LC-H b25-2 A,Star,M (Red dwarf) Star,2982,8.953491,0.5624083968368081,0.398438,M4,Va
Hegoea LC-H b25-2,Hegoea LC-H b25-2 B,Star,M (Red dwarf) Star,2335,10.580597,0.433654751976995,0.25,M8,Va
Hegoea LC-H b25-2,Hegoea LC-H b25-2 C,Star,M (Red dwarf) Star,2421,10.403549,0.43765256649892165,0.28125,M7,Va
Dryaa Pri CX-F c86,Dryaa Pri CX-F c86,Star,K (Yellow-Orange) Star,4088,7.011963,0.731567344356578,0.542969,K7,Va
Blaa Byoea EH-K c25-2,Blaa Byoea EH-K c25-2 A,Star,K (Yellow-Orange) Star,4107,7.015335,0.7236937800143781,0.6875,K7,Va
Blaa Byoea EH-K c25-2,Blaa Byoea EH-K c25-2 B,Star,M (Red dwarf) Star,3543,8.214111,0.5599670107836089,0.429688,M0,Va
Blaa Byoea EH-K c25-2,Blaa Byoea EH-K c25-2 C,Star,M (Red dwarf) Star,2317,10.705856,0.4157409633357297,0.21875,M8,Va
Pyriveae QF-E d12-7,Pyriveae QF-E d12-7,Star,G (White-Yellow) Star,5625,4.775772,1.0818175355859094,0.996094,G4,Vab
Hypoe Bluae QN-B d5173,Hypoe Bluae QN-B d5173,Star,F (White) Star,6967,3.520081,1.2571410035945363,1.339844,F3,Vb
Thailooe IF-A c29-0,Thailooe IF-A c29-0 A,Star,K (Yellow-Orange) Star,5051,5.411438,1.001251151689432,0.882813,K0,Va
Thailooe IF-A c29-0,Thailooe IF-A c29-0 B,Star,M (Red dwarf) Star,3638,7.523743,0.7298278418404026,0.519531,M0,Va
Athaip SZ-H c25-2455,Athaip SZ-H c25-2455,Star,K (Yellow-Orange) Star,4377,6.730225,0.7265319108554996,0.621094,K5,Va
Blae Drye ZD-T c6-17,Blae Drye ZD-T c6-17 A,Star,K (Yellow-Orange) Star,4294,6.756516,0.7458190539180446,0.585938,K6,Va
Blae Drye ZD-T c6-17,Blae Drye ZD-T c6-17 B,Star,M (Red dwarf) Star,2611,9.752411,0.5078124859813085,0.324219,M6,Va
Blae Drye FU-I b15-4,Blae Drye FU-I b15-4,Star,M (Red dwarf) Star,2469,10.644135,0.3766784644140906,0.230469,M7,Va
Drojao ID-U b9-4,Drojao ID-U b9-4 A,Star,T Tauri Star,2416,10.099777,0.5054321092739037,0.300781,TTS7,Va
Drojao ID-U b9-4,Drojao ID-U b9-4 B,Star,T Tauri Star,2043,11.096771,0.44665526383896476,0.25,TTS9,VI
Drojao ID-U b9-4,Drojao ID-U b9-4 C,Star,T Tauri Star,1084,15.578018,0.20156859813084113,0.070313,TTS3,VI
Synuefai YI-B d0,Synuefai YI-B d0,Star,F (White) Star,6890,3.891052,1.0835876347951114,1.277344,F4,VI
Mylaifa ZG-C d13-4458,Mylaifa ZG-C d13-4458 A,Star,F (White) Star,7039,3.673126,1.1477660618260244,1.421875,F3,Vb
Mylaifa ZG-C d13-4458,Mylaifa ZG-C d13-4458 B,Star,G (White-Yellow) Star,5384,5.073578,1.0295409920920202,0.984375,G7,Va
Mylaifa ZG-C d13-4458,Mylaifa ZG-C d13-4458 C,Star,G (White-Yellow) Star,5814,4.793625,1.0043334579439251,0.917969,G2,Vab
Thuechu PP-O a19-1,Thuechu PP-O a19-1 A,Star,L (Brown dwarf) Star,1758,12.752701,0.28143309849029474,0.152344,L3,V
Thuechu PP-O a19-1,Thuechu PP-O a19-1 B,Star,T (Brown dwarf) Star,736,18.878525,0.12686157296908698,0.035156,T9,V
Athairk LC-K d9-8078,Athairk LC-K d9-8078,Star,Neutron Star,2516784,5.039444,1.5529520129403306e-05,0.808594,None,VII
Blua Eaec CM-D b55-4,Blua Eaec CM-D b55-4,Star,M (Red dwarf) Star,2729,9.708939,0.4742431286843997,0.335938,M5,Va
Thaileia IJ-P a5-0,Thaileia IJ-P a5-0,Star,M (Red dwarf) Star,2146,11.499329,0.33633419410496046,0.183594,M9,VI
Gria Gree LL-S a72-0,Gria Gree LL-S a72-0,Star,T (Brown dwarf) Star,895,16.929749,0.15869140474478793,0.050781,T6,V
Brairee AK-A c29-541,Brairee AK-A c29-541 A,Star,K (Yellow-Orange) Star,5128,5.537704,0.9165648425593098,0.769531,K0,Va
Brairee AK-A c29-541,Brairee AK-A c29-541 B,Star,M (Red dwarf) Star,3603,8.094437,0.5721434823867722,0.414063,M0,Va
Gria Gree FB-D b32-1,Gria Gree FB-D b32-1,Star,M (Red dwarf) Star,2250,10.987396,0.38726804888569377,0.25,M8,Va
Pyrivo CI-X b20-5,Pyrivo CI-X b20-5 A,Star,M (Red dwarf) Star,2876,9.121231,0.55969233069734,0.386719,M4,Va
Pyrivo CI-X b20-5,Pyrivo CI-X b20-5 B,Star,M (Red dwarf) Star,2410,10.236389,0.4769896994967649,0.289063,M7,Va
Pyrivo CI-X b20-5,Pyrivo CI-X b20-5 C,Star,L (Brown dwarf) Star,1606,12.814972,0.32769771387491015,0.148438,L5,V
Pyraleau OB-C b46-5,Pyraleau OB-C b46-5,Star,M (Red dwarf) Star,2767,9.608017,0.4832458260244428,0.304688,M5,Va
Thuecheae GG-K b42-3,Thuecheae GG-K b42-3 A,Star,M (Red dwarf) Star,2019,11.576385,0.3667297311286844,0.207031,M9,VI
Thuecheae GG-K b42-3,Thuecheae GG-K b42-3 B,Star,T (Brown dwarf) Star,1227,14.803162,0.22476194967649174,0.085938,T1,V
Ploi Thua LI-B c13-8,Ploi Thua LI-B c13-8,Star,M (Red dwarf) Star,3341,8.258331,0.6170349043853343,0.480469,M2,Va
Tyroosks VN-F c1,Tyroosks VN-F c1,Star,K (Yellow-Orange) Star,3893,7.091263,0.7777709734004313,0.640625,K8,Va
Pyriveae LJ-V b33-0,Pyriveae LJ-V b33-0,Star,M (Red dwarf) Star,2299,10.586914,0.44604489432063266,0.257813,M8,Va
Wredguia YH-F b52-5,Wredguia YH-F b52-5 A,Star,M (Red dwarf) Star,2982,8.823349,0.5971373918044572,0.382813,M4,Va
Wredguia YH-F b52-5,Wredguia YH-F b52-5 B,Star,L (Brown dwarf) Star,1516,13.537888,0.2636413515456506,0.113281,L6,V
Hyuqoae YL-T b50-153,Hyuqoae YL-T b50-153 A,Star,M (Red dwarf) Star,3166,8.877365,0.5167236232925952,0.363281,M3,Va
Hyuqoae YL-T b50-153,Hyuqoae YL-T b50-153 B,Star,L (Brown dwarf) Star,1432,13.802917,0.26153560891445005,0.121094,L8,V
Byoi Euq KD-I c23-41,Byoi Euq KD-I c23-41 A,Star,M (Red dwarf) Star,3605,7.966675,0.6061400891445003,0.5,M0,Va
Byoi Euq KD-I c23-41,Byoi Euq KD-I c23-41 B,Star,M (Red giant) Star,2311,10.481903,0.4632873040977714,0.273438,M8,IVb
Byoi Euq KD-I c23-41,Byoi Euq KD-I c23-41 C,Star,L (Brown dwarf) Star,1875,11.94165,0.35940550395398996,0.1875,L1,V
Byoi Euq KD-I c23-41,Byoi Euq KD-I c23-41 D,Star,M (Red dwarf) Star,2260,11.236954,0.34219357584471605,0.199219,M8,Va
Oochost QP-U b49-0,Oochost QP-U b49-0 A,Star,M (Red dwarf) Star,2722,9.857727,0.4451293860531991,0.3125,M5,Va
Oochost QP-U b49-0,Oochost QP-U b49-0 B,Star,M (Red dwarf) Star,2422,10.449692,0.4281005549964055,0.242188,M7,Va
Plaa Chraei GF-R d4-24,Plaa Chraei GF-R d4-24,Star,A (Blue-White) Star,8509,2.272446,1.4968871200575127,1.726563,A5,Vb
Hyuqoae GN-H d11-1950,Hyuqoae GN-H d11-1950,Star,A (Blue-White) Star,7770,2.948151,1.3152160115025162,1.59375,A8,VI
Shrogaei PK-M d8-374,Shrogaei PK-M d8-374,Star,F (White) Star,6383,4.24118,1.074584845434939,1.070313,F7,Vb
Swoiwns ZA-X b30-0,Swoiwns ZA-X b30-0 A,Star,M (Red dwarf) Star,3618,8.139496,0.5557555715312724,0.410156,M0,Va
Swoiwns ZA-X b30-0,Swoiwns ZA-X b30-0 B,Star,M (Red dwarf) Star,2268,11.033875,0.37307734867002157,0.199219,M8,Va
Swoiwns ZA-X b30-0,Swoiwns ZA-X b30-0 C,Star,T (Brown dwarf) Star,878,17.348404,0.13598632350826742,0.046875,T7,V
Aucoks KG-E b18-3,Aucoks KG-E b18-3,Star,M (Red dwarf) Star,2810,9.515945,0.48886107836089143,0.371094,M5,Va
Truechiae PW-N d6-0,Truechiae PW-N d6-0,Star,F (White) Star,6586,4.207947,1.0249328080517612,1.214844,F6,Vb
Dryio Flyuae OJ-I b25-24,Dryio Flyuae OJ-I b25-24,Star,M (Red dwarf) Star,3137,8.960098,0.5066528023005032,0.382813,M3,Va
Chau Thua HA-N b34-0,Chau Thua HA-N b34-0,Star,M (Red dwarf) Star,3060,8.922241,0.5418395514018691,0.363281,M3,Va
Striechae OD-S c20-3,Striechae OD-S c20-3 A,Star,K (Yellow-Orange) Star,3926,7.46138,0.6449279079798707,0.558594,K8,Va
Striechae OD-S c20-3,Striechae OD-S c20-3 B,Star,M (Red dwarf) Star,2434,10.714081,0.3753051560028756,0.222656,M7,Va
Shrogaae AB-F d11-6678,Shrogaae AB-F d11-6678,Star,F (White) Star,6669,3.804901,1.2033995916606757,1.296875,F5,Vb
Tyriedgaa XK-L b35-0,Tyriedgaa XK-L b35-0,Star,M (Red dwarf) Star,2868,9.325745,0.5122375499640547,0.300781,M4,Va
Eoch Flyuae SD-J d9-2134,Eoch Flyuae SD-J d9-2134,Star,F (White) Star,6141,4.587311,0.9899596376707405,1.136719,F9,Vb
Eoch Flyuae SD-J d9-2134,Eoch Flyuae SD-J d9-2134 5,Star,Y (Brown dwarf) Star,497,20.244217,0.0914001380301941,0.023438,Y2,V
Eoch Flyuae SD-J d9-2134,Eoch Flyuae SD-J d9-2134 7,Star,Y (Brown dwarf) Star,453,21.562897,0.07672118475916606,0.015625,Y3,V
Flyai Phoe WS-O b37-0,Flyai Phoe WS-O b37-0 A,Star,M (Red dwarf) Star,3498,8.337692,0.5426940503235083,0.421875,M1,Va
Flyai Phoe WS-O b37-0,Flyai Phoe WS-O b37-0 B,Star,M (Red dwarf) Star,2235,11.096298,0.3732909964054637,0.214844,M8,Va
Flyai Phoe WS-O b37-0,Flyai Phoe WS-O b37-0 C,Star,L (Brown dwarf) Star,1432,13.752289,0.26770017541337165,0.113281,L8,V
Kyloall IK-D d13-4091,Kyloall IK-D d13-4091,Star,Neutron Star,5608724,4.332169,1.5658698777857658e-05,0.792969,None,VII
Pyrivo TL-J d10-59,Pyrivo TL-J d10-59 A,Star,G (White-Yellow) Star,5895,4.766434,0.9892577081236521,1.160156,G1,Vab
Pyrivo TL-J d10-59,Pyrivo TL-J d10-59 B,Star,M (Red dwarf) Star,3678,7.626144,0.681152322070453,0.523438,M0,Va
Pyrivo FE-J c25-6,Pyrivo FE-J c25-6 A,Star,K (Yellow-Orange) Star,4009,7.328674,0.6574706657081236,0.578125,K7,Va
Pyrivo FE-J c25-6,Pyrivo FE-J c25-6 B,Star,M (Red dwarf) Star,2151,11.184753,0.38693235945363047,0.234375,M9,VI
Brairee YB-B d14-2376,Brairee YB-B d14-2376 A,Star,G (White-Yellow) Star,5785,4.550446,1.134612980589504,1.140625,G2,Vab
Brairee YB-B d14-2376,Brairee YB-B d14-2376 B,Star,M (Red dwarf) Star,2734,9.839783,0.44488521063982744,0.3125,M5,Va
Brairee YB-B d14-2376,Brairee YB-B d14-2376 C,Star,K (Yellow-Orange) Star,4710,6.428192,0.7210388152408339,0.667969,K3,Vab
Mylaifa SJ-Q d5-3569,Mylaifa SJ-Q d5-3569,Star,F (White) Star,6548,4.111664,1.083862222861251,1.277344,F6,Vb
Dryiqau NC-L b25-3,Dryiqau NC-L b25-3 A,Star,M (Red dwarf) Star,2690,9.530029,0.5299987232207045,0.34375,M5,Va
Pyra Eop CD-M c10-0,Pyra Eop CD-M c10-0 A,Star,K (Yellow-Orange) Star,4614,5.984756,0.9215392667145939,0.832031,K3,Va
Pyra Eop CD-M c10-0,Pyra Eop CD-M c10-0 B,Star,M (Red dwarf) Star,2872,9.407349,0.4919738432782171,0.339844,M4,Va
Pro Aeg NM-K c22-0,Pro Aeg NM-K c22-0 A,Star,K (Yellow-Orange) Star,5030,5.524307,0.9585265736879942,0.8125,K1,Va
Pro Aeg NM-K c22-0,Pro Aeg NM-K c22-0 B,Star,K (Yellow-Orange) Star,3742,7.70108,0.6357421365923795,0.441406,K9,Va
Croomoi EL-P e5-3368,Croomoi EL-P e5-3368,Star,Neutron Star,1869898,5.065018,1.1755257009345794e-05,1.871094,None,VII
Dryooe Flyou WT-J b38-36,Dryooe Flyou WT-J b38-36 A,Star,M (Red dwarf) Star,3416,8.263138,0.5889281840402588,0.394531,M1,Va
Dryooe Flyou WT-J b38-36,Dryooe Flyou WT-J b38-36 B,Star,M (Red dwarf) Star,2017,11.76329,0.33715818835370237,0.167969,M9,VI
Drojeae HZ-K b55-4,Drojeae HZ-K b55-4,Star,M (Red dwarf) Star,2978,9.057663,0.5375060474478792,0.359375,M4,Va
Nyauthou PJ-I c25-6,Nyauthou PJ-I c25-6 A,Star,K (Yellow-Orange) Star,4863,6.154953,0.7670592322070453,0.652344,K2,Vab
Nyauthou PJ-I c25-6,Nyauthou PJ-I c25-6 B,Star,M (Red dwarf) Star,2299,10.99884,0.36898799712437097,0.226563,M8,Va
Hypuae Audst SY-S d3-6,Hypuae Audst SY-S d3-6 A,Star,G (White-Yellow) Star,5294,5.355728,0.9351500560747663,1.03125,G8,Vab
Hypuae Audst SY-S d3-6,Hypuae Audst SY-S d3-6 B,Star,M (Red dwarf) Star,2777,9.336716,0.5436095585909417,0.335938,M5,Va
Boelts TC-K c9-73,Boelts TC-K c9-73,Star,K (Yellow-Orange) Star,4498,6.496048,0.7662962933141625,0.605469,K4,Va
