system,body,type,subType,temp,radius,absMagnitude,solMass,spectralClass,luminosity
Bleae Briae RK-I c9-24,Bleae Briae RK-I c9-24,Star,K (Yellow-Orange) Star,4935,5.640793,0.9437865132997844,0.816406,K1,Vz
Nuekuae NS-L b52-22,Nuekuae NS-L b52-22,Star,M (Red dwarf) Star,3189,8.683975,0.5567321351545651,0.382813,M3,Va
Pyuefoea JB-V d3-21,Pyuefoea JB-V d3-21 A,Star,F (White) Star,6399,4.333313,1.024810697340043,1.207031,F7,Vb
Pyuefoea JB-V d3-21,Pyuefoea JB-V d3-21 B,Star,K (Yellow-Orange) Star,4245,6.790329,0.7513427462257369,0.574219,K6,Va
Pyuefoea JB-V d3-21,Pyuefoea JB-V d3-21 C,Star,K (Yellow-Orange) Star,3779,7.357376,0.7302245866283249,0.554688,K9,Va
Pyuefoea JB-V d3-21,Pyuefoea JB-V d3-21 D,Star,M (Red dwarf) Star,2792,9.52269,0.4936522904385334,0.292969,M5,Va
Mylienga EV-H b10-2,Mylienga EV-H b10-2,Star,M (Red dwarf) Star,2435,10.652206,0.3858337311286844,0.234375,M7,Va
Stuemeae XY-S b3-5,Stuemeae XY-S b3-5 A,Star,M (Red dwarf) Star,2907,9.37207,0.48806763479511145,0.347656,M4,Va
Stuemeae XY-S b3-5,Stuemeae XY-S b3-5 B,Star,M (Red dwarf) Star,2976,9.028259,0.5455627318475916,0.34375,M4,Va
Dryaa Pri CD-Y a22,Dryaa Pri CD-Y a22 A,Star,L (Brown dwarf) Star,1868,12.048248,0.34475702659956864,0.191406,L1,V
Dryaa Pri CD-Y a22,Dryaa Pri CD-Y a22 B,Star,T (Brown dwarf) Star,1195,15.17601,0.1995849432063264,0.085938,T1,V
Drootie XO-X a14-3,Drootie XO-X a14-3,Star,T (Brown dwarf) Star,1122,15.556671,0.19000243853342919,0.074219,T2,V
Ploi Aub VN-S b5-18,Ploi Aub VN-S b5-18,Star,M (Red dwarf) Star,2266,10.970001,0.384887672178289,0.253906,M8,Va
Blua Eaec HM-V b47-29,Blua Eaec HM-V b47-29,Star,M (Red dwarf) Star,3164,8.517654,0.6105651071171819,0.414063,M3,Va
Bleia Dryiae XU-N c23-5,Bleia Dryiae XU-N c23-5 A,Star,K (Yellow-Orange) Star,5031,6.003098,0.7685851099928109,0.742188,K1,Vab
Bleia Dryiae XU-N c23-5,Bleia Dryiae XU-N c23-5 B,Star,M (Red dwarf) Star,2291,10.608154,0.4447936506110712,0.242188,M8,Va
Plaa Briae TG-F b52-6,Plaa Briae TG-F b52-6 A,Star,M (Red dwarf) Star,2889,9.337433,0.5021056736161035,0.359375,M4,Va
Plaa Briae TG-F b52-6,Plaa Briae TG-F b52-6 B,Star,M (Red dwarf) Star,2232,11.174927,0.36099239108555,0.226563,M8,Va
Myriesly GA-P c19-5713,Myriesly GA-P c19-5713,Star,K (Yellow-Orange) Star,3900,7.369507,0.6817931502516176,0.550781,K8,Va
Scheau Phoe SO-R c20-1,Scheau Phoe SO-R c20-1,Star,K (Yellow-Orange) Star,5116,5.388962,0.9861449432063264,0.84375,K0,Va
Smootoae GH-F b52-16,Smootoae GH-F b52-16,Star,M (Red dwarf) Star,3253,8.451141,0.5955810093457944,0.417969,M2,Va
Fachiae JA-H c13-0,Fachiae JA-H c13-0,Star,K (Yellow-Orange) Star,4001,7.10025,0.7333068468727534,0.605469,K7,Va
Gria Gree SM-H b2-0,Gria Gree SM-H b2-0 A,Star,M (Red dwarf) Star,3150,8.82402,0.5349731013659238,0.351563,M3,Va
Gria Gree SM-H b2-0,Gria Gree SM-H b2-0 B,Star,L (Brown dwarf) Star,1849,12.263596,0.3186645578720345,0.144531,L2,V
Gria Gree SM-H b2-0,Gria Gree SM-H b2-0 C,Star,M (Red dwarf) Star,2136,11.368866,0.36050410927390364,0.230469,M9,VI
Plua Aewsy NA-N b34-7,Plua Aewsy NA-N b34-7 A,Star,M (Red dwarf) Star,3555,7.989166,0.616882289000719,0.417969,M0,Va
Plua Aewsy NA-N b34-7,Plua Aewsy NA-N b34-7 B,Star,L (Brown dwarf) Star,1935,11.651138,0.3857421710999281,0.199219,L0,V
Smootiae QH-U c16-32,Smootiae QH-U c16-32 A,Star,K (Yellow-Orange) Star,4613,6.240372,0.8195800431344357,0.765625,K3,Va
Smootiae QH-U c16-32,Smootiae QH-U c16-32 B,Star,M (Red dwarf) Star,2175,11.284546,0.36145016822429904,0.230469,M8,Va
Smootiae QH-U c16-32,Smootiae QH-U c16-32 C,Star,L (Brown dwarf) Star,1534,13.408844,0.27325437239396116,0.117188,L6,V
Smootiae QH-U c16-32,Smootiae QH-U c16-32 D,Star,M (Red dwarf) Star,3157,9.053818,0.4791259468008627,0.332031,M3,Va
Smootiae QH-U c16-32,Smootiae QH-U c16-32 E,Star,L (Brown dwarf) Star,1896,12.041107,0.33575437526959023,0.171875,L1,V
Hyuqoae GN-H d11-3756,Hyuqoae GN-H d11-3756,Star,Neutron Star,2435277,4.90535,1.6141714593817398e-05,0.710938,None,VII
Blu Thua HL-Y e5,Blu Thua HL-Y e5 A,Star,B (Blue-White) Star,14833,-1.359299,2.6222229072609635,4.160156,B7,Vz
Blu Thua HL-Y e5,Blu Thua HL-Y e5 B,Star,B (Blue-White) Star,12489,-0.409943,2.3891294780733285,3.613281,B8,Vz
Dryio Flyuae QO-R e4-289,Dryio Flyuae QO-R e4-289,Star,B (Blue-White) Star,11486,0.081863,2.2522887361610353,3.289063,B9,Vz
Puekee KZ-A a82-2,Puekee KZ-A a82-2,Star,T (Brown dwarf) Star,834,17.342972,0.15109252048885694,0.050781,T7,V
Pyra Eop YL-J d10-0,Pyra Eop YL-J d10-0 A,Star,F (White) Star,6381,4.47966,0.9634704471603163,1.109375,F7,VI
Pyra Eop YL-J d10-0,Pyra Eop YL-J d10-0 B,Star,K (Yellow-Orange) Star,3732,8.006866,0.5552062573687995,0.445313,K9,Va
Pyriveae FQ-I c24-3,Pyriveae FQ-I c24-3,Star,M (Red dwarf) Star,3297,8.375488,0.6003417627606039,0.480469,M2,Va
Blua Eaec ZL-L d8-249,Blua Eaec ZL-L d8-249,Star,A (Blue-White) Star,7753,2.718704,1.4681699381739755,1.695313,A8,Vb
Thuechu RS-C a12-6,Thuechu RS-C a12-6,Star,T (Brown dwarf) Star,727,18.132446,0.13824461250898634,0.042969,T9,V
Dryiqou JM-L c24-9,Dryiqou JM-L c24-9,Star,K (Yellow-Orange) Star,5100,5.79454,0.8233031775700934,0.855469,K0,Vab
Prielu XJ-R d4-67,Prielu XJ-R d4-67 A,Star,F (White) Star,7428,2.826752,1.5218504327821711,1.75,F0,Vab
Prielu XJ-R d4-67,Prielu XJ-R d4-67 B,Star,K (Yellow-Orange) Star,4544,6.263153,0.8358458892882819,0.765625,K4,Va
Prielu XJ-R d4-67,Prielu XJ-R d4-67 C,Star,M (Red dwarf) Star,3590,7.878082,0.6366576908698778,0.550781,M0,Va
Prielu XJ-R d4-67,Prielu XJ-R d4-67 D,Star,M (Red dwarf) Star,2183,11.112411,0.388397181883537,0.207031,M8,Va
Prielu XJ-R d4-67,Prielu XJ-R d4-67 E,Star,L (Brown dwarf) Star,1955,11.642166,0.3794555629043853,0.207031,L0,V
Prielu XJ-R d4-67,Prielu XJ-R d4-67 F,Star,L (Brown dwarf) Star,1734,12.743561,0.2904968051761323,0.140625,L3,V
Stuemeae YZ-Y c980,Stuemeae YZ-Y c980,Star,K (Yellow-Orange) Star,4793,5.702118,0.9726867232207045,0.855469,K2,Va
Shrogaae BL-P e5-252,Shrogaae BL-P e5-252,Star,A (Blue-White) Star,8135,2.518539,1.462249639108555,1.945313,A7,Vab
Truechuae JN-Z c27-41,Truechuae JN-Z c27-41 A,Star,K (Yellow-Orange) Star,3888,7.362503,0.688232396836808,0.480469,K8,Va
Truechuae JN-Z c27-41,Truechuae JN-Z c27-41 B,Star,M (Red dwarf) Star,3102,9.007019,0.5070800517613228,0.386719,M3,Va
Truechuae JN-Z c27-41,Truechuae JN-Z c27-41 C,Star,L (Brown dwarf) Star,1615,13.359741,0.25216671746944647,0.125,L5,V
Truechuae JN-Z c27-41,Truechuae JN-Z c27-41 D,Star,L (Brown dwarf) Star,1656,12.698853,0.3251342401150252,0.144531,L4,V
Gria Gree ZJ-L a76-2,Gria Gree ZJ-L a76-2,Star,T (Brown dwarf) Star,789,17.810257,0.1361389043853343,0.046875,T8,V
Pyrivo JH-L c24-16,Pyrivo JH-L c24-16,Star,G (White-Yellow) Star,5670,5.009064,0.9562987663551402,0.886719,G4,Vab
Stuemeae QT-Z c5018,Stuemeae QT-Z c5018 A,Star,K (Yellow-Orange) Star,4522,6.548004,0.740264856937455,0.652344,K4,Va
Stuemeae QT-Z c5018,Stuemeae QT-Z c5018 B,Star,M (Red dwarf) Star,3639,7.642975,0.6904601581595974,0.523438,M0,Va
Stuemeae QT-Z c5018,Stuemeae QT-Z c5018 C,Star,L (Brown dwarf) Star,1933,11.934158,0.3393249403306973,0.203125,L0,V
Traikea VI-T d3-43,Traikea VI-T d3-43,Star,A (Blue-White) Star,7707,3.240082,1.1686706427030913,1.449219,A9,VI
Pyrivo PZ-D d13-41,Pyrivo PZ-D d13-41 A,Star,F (White) Star,6495,3.859818,1.2370605549964055,1.246094,F6,Vb
Pyrivo PZ-D d13-41,Pyrivo PZ-D d13-41 B,Star,M (Red dwarf) Star,2086,11.273132,0.3950195025161754,0.210938,M9,VI
Pyrivo PZ-D d13-41,Pyrivo PZ-D d13-41 C,Star,L (Brown dwarf) Star,1391,14.17804,0.23321530984902947,0.09375,L8,V
Pyrivo PZ-D d13-41,Pyrivo PZ-D d13-41 D,Star,T (Brown dwarf) Star,1219,15.149551,0.19415281092739037,0.082031,T1,V
Thuechu IX-A d1-135,Thuechu IX-A d1-135 A,Star,Neutron Star,4457646,5.217896,1.7439117541337168e-05,0.570313,None,VII
Thuechu IX-A d1-135,Thuechu IX-A d1-135 B,Star,M (Red dwarf) Star,3638,7.99617,0.5871581308411215,0.433594,M0,Va
Synuefai KV-D c0,Synuefai KV-D c0 A,Star,K (Yellow-Orange) Star,3993,7.09166,0.739166228612509,0.617188,K8,Va
Pyrivo TF-C d14-85,Pyrivo TF-C d14-85,Star,G (White-Yellow) Star,5757,4.980972,0.9396972307692307,1.007813,G3,Vab
Eok Bluae HV-Q c7-3420,Eok Bluae HV-Q c7-3420,Star,K (Yellow-Orange) Star,4295,6.415237,0.8723143867721064,0.699219,K6,Va
Nuekuae PM-O c21-79,Nuekuae PM-O c21-79,Star,G (White-Yellow) Star,5480,5.243668,0.918945311286844,0.859375,G6,Vab
Nuwo MY-N b40-0,Nuwo MY-N b40-0,Star,M (Red dwarf) Star,2123,11.170059,0.39990232063263836,0.238281,M9,VI
Ploi Briae AZ-H c23-19,Ploi Briae AZ-H c23-19,Star,K (Yellow-Orange) Star,3700,7.822067,0.61502072178289,0.484375,K9,Va
Bleae Thua CF-P b19-13,Bleae Thua CF-P b19-13 A,Star,M (Red dwarf) Star,2635,9.870041,0.4723205521207764,0.292969,M6,Va
Bleae Thua CF-P b19-13,Bleae Thua CF-P b19-13 B,Star,L (Brown dwarf) Star,1800,12.441025,0.3098754622573688,0.136719,L2,V
Bleae Thua CF-P b19-13,Bleae Thua CF-P b19-13 C,Star,T (Brown dwarf) Star,1121,15.200684,0.22424314018691588,0.085938,T2,V
Thuecheae HU-Q c21-22,Thuecheae HU-Q c21-22 A,Star,K (Yellow-Orange) Star,4053,7.046951,0.732360787922358,0.636719,K7,Va
Thuecheae HU-Q c21-22,Thuecheae HU-Q c21-22 B,Star,M (Red dwarf) Star,2475,10.696487,0.36593624155283966,0.234375,M7,Va
Thuecheae HU-Q c21-22,Thuecheae HU-Q c21-22 C,Star,L (Brown dwarf) Star,1644,13.23407,0.2578430021567218,0.132813,L5,V
Bleia Byoe BA-W a15-2,Bleia Byoe BA-W a15-2 A,Star,L (Brown dwarf) Star,1672,12.830795,0.30014037670740473,0.136719,L4,V
Bleia Byoe BA-W a15-2,Bleia Byoe BA-W a15-2 B,Star,T (Brown dwarf) Star,781,17.673126,0.1428527735442128,0.039063,T8,V
Drojao WA-E a25-1,Drojao WA-E a25-1 A,Star,L (Brown dwarf) Star,1485,13.478973,0.28231810208483105,0.125,L7,V
Drojao WA-E a25-1,Drojao WA-E a25-1 B,Star,L (Brown dwarf) Star,1395,13.83017,0.2721557440690151,0.121094,L8,V
Drojao WA-E a25-1,Drojao WA-E a25-1 C,Star,Y (Brown dwarf) Star,668,18.813049,0.1065063407620417,0.03125,Y0,V
Chua Eohn WB-Y b6-0,Chua Eohn WB-Y b6-0 A,Star,M (Red dwarf) Star,3041,8.767838,0.589050294751977,0.394531,M3,Va
Chua Eohn WB-Y b6-0,Chua Eohn WB-Y b6-0 B,Star,L (Brown dwarf) Star,1800,12.565369,0.29263305248023,0.148438,L2,V
Athairk BX-Q c6-894,Athairk BX-Q c6-894 A,Star,K (Yellow-Orange) Star,4857,5.858292,0.8815002041696621,0.800781,K2,Va
Athairk BX-Q c6-894,Athairk BX-Q c6-894 B,Star,M (Red dwarf) Star,2683,9.962631,0.43655389216391083,0.289063,M5,Va
Athairk BX-Q c6-894,Athairk BX-Q c6-894 C,Star,L (Brown dwarf) Star,1440,13.83078,0.25534056074766354,0.109375,L7,V
Byoomao XE-X d2-8253,Byoomao XE-X d2-8253,Star,F (White) Star,7162,3.708344,1.0908507836089145,1.230469,F2,VI
Drooteou IO-X d2-123,Drooteou IO-X d2-123 A,Star,K (Yellow-Orange) Star,5191,5.293671,1.0007933515456506,0.894531,K0,Va
Drooteou IO-X d2-123,Drooteou IO-X d2-123 B,Star,G (White-Yellow) Star,5353,5.315094,0.9319152724658519,0.890625,G8,Vab
Drooteou IO-X d2-123,Drooteou IO-X d2-123 C,Star,M (Red dwarf) Star,2972,9.480331,0.4442443824586628,0.316406,M4,Va
Drooteou IO-X d2-123,Drooteou IO-X d2-123 D,Star,M (Red dwarf) Star,2509,10.312393,0.4249572393961179,0.269531,M7,Va
Drooteou IO-X d2-123,Drooteou IO-X d2-123 E,Star,M (Red dwarf) Star,3090,9.126907,0.48358151545650613,0.347656,M3,Va
Boelts IA-H b26,Boelts IA-H b26,Star,M (Red dwarf) Star,2081,11.475403,0.3616332652767793,0.203125,M9,VI
Smootiae UD-K d8-181,Smootiae UD-K d8-181 A,Star,F (White) Star,7067,3.335083,1.3304442386772106,1.460938,F2,Vb
Smootiae UD-K d8-181,Smootiae UD-K d8-181 B,Star,M (Red dwarf) Star,3319,8.125992,0.664520189791517,0.449219,M2,Va
Phraa Hypai JV-I c11-2,Phraa Hypai JV-I c11-2,Star,M (Red dwarf) Star,3305,8.480362,0.5692748468727534,0.449219,M2,Va
NGC 6871 Sector BY-Y b15-2,NGC 6871 Sector BY-Y b15-2 A,Star,T Tauri Star,2914,8.770126,0.6408385794392524,0.445313,TTS4,Va
NGC 6871 Sector BY-Y b15-2,NGC 6871 Sector BY-Y b15-2 B,Star,T Tauri Star,2042,11.368912,0.3944396836808052,0.203125,TTS9,VI
Smootiae DW-E d11-69,Smootiae DW-E d11-69 A,Star,F (White) Star,6785,3.523178,1.3236083393242273,1.515625,F4,Vab
Smootiae DW-E d11-69,Smootiae DW-E d11-69 B,Star,K (Yellow-Orange) Star,4605,5.865738,0.9772643565780015,0.828125,K3,Va
Dryaa Pri CX-F c73,Dryaa Pri CX-F c73,Star,K (Yellow-Orange) Star,4406,6.862839,0.6745300014378145,0.613281,K5,Vab
Bleae Briae HQ-G d10-60,Bleae Briae HQ-G d10-60,Star,F (White) Star,6249,4.248138,1.117584195542775,1.078125,F8,Vb
Phraa Hypai PD-A d1-5,Phraa Hypai PD-A d1-5 A,Star,F (White) Star,7067,3.555283,1.2021789446441409,1.460938,F2,Vb
Phraa Hypai PD-A d1-5,Phraa Hypai PD-A d1-5 B,Star,M (Red dwarf) Star,3507,7.882751,0.6657104241552839,0.519531,M1,Va
Phraa Hypai PD-A d1-5,Phraa Hypai PD-A d1-5 C,Star,K (Yellow-Orange) Star,3864,7.400299,0.6847838964773544,0.5625,K8,Va
Phraa Hypai PD-A d1-5,Phraa Hypai PD-A d1-5 D,Star,M (Red dwarf) Star,2158,11.344147,0.35723875197699495,0.222656,M9,VI
Sutchooe WD-I c23-2,Sutchooe WD-I c23-2 A,Star,K (Yellow-Orange) Star,4959,5.547867,0.9755248080517613,0.839844,K1,Va
Sutchooe WD-I c23-2,Sutchooe WD-I c23-2 B,Star,K (Yellow-Orange) Star,3729,7.408356,0.7325439079798706,0.542969,K9,Va
Sutchooe WD-I c23-2,Sutchooe WD-I c23-2 C,Star,M (Red dwarf) Star,2732,9.492706,0.5227355744069015,0.339844,M5,Va
Sutchooe WD-I c23-2,Sutchooe WD-I c23-2 D,Star,M (Red dwarf) Star,2751,9.566345,0.4983519884974838,0.355469,M5,Va
Truechuae KC-K c22-31,Truechuae KC-K c22-31 A,Star,K (Yellow-Orange) Star,4394,6.807663,0.6956786657081236,0.570313,K5,Vab
Truechuae KC-K c22-31,Truechuae KC-K c22-31 B,Star,M (Red dwarf) Star,2371,10.305603,0.47735593961179007,0.269531,M7,Va
Truechuae KC-K c22-31,Truechuae KC-K c22-31 C,Star,M (Red dwarf) Star,2204,11.353882,0.34094233213515457,0.199219,M8,Va
Blua Hypue AF-Y c17-339,Blua Hypue AF-Y c17-339,Star,K (Yellow-Orange) Star,4986,5.863495,0.8344725808770669,0.859375,K1,Vab
Eord Flyuae XJ-A e2899,Eord Flyuae XJ-A e2899,Star,B (Blue-White) Star,10226,0.924408,1.9278868612508986,2.601563,B9,Vz
Syre Thua CO-X c28-1,Syre Thua CO-X c28-1 A,Star,K (Yellow-Orange) Star,5029,5.740295,0.8681335442127965,0.742188,K1,Va
Syre Thua CO-X c28-1,Syre Thua CO-X c28-1 B,Star,K (Yellow-Orange) Star,3780,7.543152,0.670013377426312,0.546875,K9,Va
Blae Drye QY-D b4-1,Blae Drye QY-D b4-1 A,Star,M (Red dwarf) Star,3136,8.86351,0.5300292739036664,0.386719,M3,Va
Blae Drye QY-D b4-1,Blae Drye QY-D b4-1 B,Star,L (Brown dwarf) Star,1421,13.862946,0.2583617886412653,0.113281,L8,V
Blae Drye QY-D b4-1,Blae Drye QY-D b4-1 C,Star,M (Red dwarf) Star,2123,11.138947,0.4056701423436377,0.234375,M9,VI
Striechae CI-G b57-0,Striechae CI-G b57-0,Star,M (Red dwarf) Star,2456,10.633194,0.38259885549964057,0.234375,M7,Va
Synuefe RO-B a109-3,Synuefe RO-B a109-3,Star,Y (Brown dwarf) Star,409,21.849533,0.08056640115025161,0.015625,Y4,V
Truechiae SR-R b45-9,Truechiae SR-R b45-9,Star,M (Red dwarf) Star,2539,9.914322,0.4984435945363048,0.316406,M6,Va
Byua Chrea RG-Y d89,Byua Chrea RG-Y d89,Star,F (White) Star,6470,4.03894,1.147949181883537,1.351563,F6,Vb
Smootoae IL-E c25-15,Smootoae IL-E c25-15,Star,K (Yellow-Orange) Star,4427,6.693954,0.7221679022286125,0.585938,K5,Va
Pru Eurk WB-X b1-1,Pru Eurk WB-X b1-1,Star,M (Red dwarf) Star,3210,8.415817,0.6216735470884256,0.417969,M2,Va
Ploi Briae NR-C c26-31,Ploi Briae NR-C c26-31 A,Star,K (Yellow-Orange) Star,3971,7.253082,0.6938476491732567,0.628906,K8,Va
Ploi Briae NR-C c26-31,Ploi Briae NR-C c26-31 B,Star,M (Red dwarf) Star,3260,8.571487,0.561065639108555,0.351563,M2,Va
Prae Flyi WG-P b38-2,Prae Flyi WG-P b38-2,Star,M (Red dwarf) Star,3211,8.78627,0.5238647074047448,0.382813,M2,Va
Smootoae MO-Z d13-189,Smootoae MO-Z d13-189 A,Star,K (Yellow-Orange) Star,4568,6.319,0.8060912724658519,0.640625,K4,Va
Smootoae MO-Z d13-189,Smootoae MO-Z d13-189 B,Star,K (Yellow-Orange) Star,4045,7.250977,0.6693419525521208,0.558594,K7,Va
Smootoae MO-Z d13-189,Smootoae MO-Z d13-189 C,Star,M (Red dwarf) Star,2674,10.089737,0.41452022429906543,0.269531,M6,Va
Boelts JB-Z c28-266,Boelts JB-Z c28-266,Star,K (Yellow-Orange) Star,4565,6.534088,0.7310485348670022,0.644531,K4,Va
Nyauthi XK-K b42-2,Nyauthi XK-K b42-2 A,Star,M (Red dwarf) Star,3258,8.851624,0.4937743551401869,0.378906,M2,Va
Nyauthi XK-K b42-2,Nyauthi XK-K b42-2 B,Star,M (Red dwarf) Star,2312,10.831482,0.39407344356578,0.222656,M8,Va
Stuelou IW-A b44-30,Stuelou IW-A b44-30,Star,M (Red dwarf) Star,2211,10.898773,0.4177550999281093,0.214844,M8,Va
Truechoae FA-A c6,Truechoae FA-A c6,Star,G (White-Yellow) Star,5635,4.910828,1.0130003738317757,0.878906,G4,Vab
Croomoea PI-S e4-242,Croomoea PI-S e4-242,Star,B (Blue-White) Star,10931,0.480133,2.070159735442128,2.949219,B9,Vz
Brairee JL-H c25-1676,Brairee JL-H c25-1676,Star,K (Yellow-Orange) Star,3855,7.521851,0.6505431603163192,0.464844,K8,Va
Striechooe DW-C d9,Striechooe DW-C d9 A,Star,F (White) Star,6925,3.673782,1.1855163076923076,1.539063,F3,Vb
Striechooe DW-C d9,Striechooe DW-C d9 B,Star,G (White-Yellow) Star,5360,5.342896,0.9176635629043853,0.789063,G7,Vab
Schao Pri VZ-O e6-69,Schao Pri VZ-O e6-69 A,Star,T Tauri Star,1830,11.919434,0.3811645377426312,0.1875,TTS2,VI
Schao Pri VZ-O e6-69,Schao Pri VZ-O e6-69 B,Star,T Tauri Star,1939,12.047592,0.32006832494608195,0.140625,TTS0,VI
Schao Pri VZ-O e6-69,Schao Pri VZ-O e6-69 C,Star,T Tauri Star,1699,12.627151,0.3192443537023724,0.140625,TTS4,VI
Dryoea Flyuae OR-C c320,Dryoea Flyuae OR-C c320,Star,K (Yellow-Orange) Star,4184,6.729507,0.7953795772825305,0.675781,K6,Va
Shrogaae XU-G d10-6457,Shrogaae XU-G d10-6457,Star,G (White-Yellow) Star,5615,4.756775,1.0952148382458662,1.035156,G4,Vab
Bleae Briae SL-T b44-3,Bleae Briae SL-T b44-3 A,Star,M (Red dwarf) Star,3442,8.20314,0.59631344356578,0.417969,M1,Va
Bleae Briae SL-T b44-3,Bleae Briae SL-T b44-3 B,Star,L (Brown dwarf) Star,1804,12.575058,0.2900390280373832,0.140625,L2,V
Eactaipp DE-L c23-0,Eactaipp DE-L c23-0 A,Star,K (Yellow-Orange) Star,4320,6.620667,0.7844237526959023,0.742188,K5,Va
Eactaipp DE-L c23-0,Eactaipp DE-L c23-0 B,Star,M (Red dwarf) Star,2482,10.199341,0.4574584730409777,0.257813,M7,Va
Eactaipp DE-L c23-0,Eactaipp DE-L c23-0 C,Star,M (Red dwarf) Star,3047,9.022995,0.5216979554277498,0.382813,M3,Va
Gria Eoq BB-R c7-0,Gria Eoq BB-R c7-0,Star,K (Yellow-Orange) Star,4352,6.488144,0.8215637210639828,0.695313,K5,Va
Oochost PB-T b9-0,Oochost PB-T b9-0,Star,M (Red dwarf) Star,2767,9.464615,0.5162353184759166,0.332031,M5,Va
Dryiqau YZ-C c14-13,Dryiqau YZ-C c14-13,Star,G (White-Yellow) Star,5345,5.291229,0.9450378030194105,0.8125,G8,Vab
Phraa Hypai PK-T b21-0,Phraa Hypai PK-T b21-0 A,Star,M (Red dwarf) Star,2099,11.522812,0.3477782774982027,0.203125,M9,VI
Phraa Hypai PK-T b21-0,Phraa Hypai PK-T b21-0 B,Star,L (Brown dwarf) Star,1300,14.61647,0.21820066139468008,0.082031,L9,V
Preae Chruia OZ-O d6-8,Preae Chruia OZ-O d6-8,Star,G (White-Yellow) Star,5660,5.128036,0.908538754852624,0.914063,G4,Vab
Plaa Briae RJ-I b9-2,Plaa Briae RJ-I b9-2 A,Star,M (Red dwarf) Star,3227,8.693359,0.5413512925952552,0.429688,M2,Va
Plaa Briae RJ-I b9-2,Plaa Briae RJ-I b9-2 B,Star,M (Red dwarf) Star,3237,8.689987,0.538848851186197,0.425781,M2,Va
Stuemaea AF-R c4-1079,Stuemaea AF-R c4-1079 A,Star,M (Red dwarf) Star,3650,7.489731,0.7364806671459382,0.542969,M0,Va
Stuemaea AF-R c4-1079,Stuemaea AF-R c4-1079 B,Star,L (Brown dwarf) Star,1407,14.055389,0.2411803882099209,0.097656,L8,V
Nyauthi DT-G c27-7,Nyauthi DT-G c27-7 A,Star,K (Yellow-Orange) Star,3887,7.591141,0.6197814751976995,0.492188,K8,Va
Nyauthi DT-G c27-7,Nyauthi DT-G c27-7 B,Star,M (Red dwarf) Star,2539,10.009888,0.4769896994967649,0.320313,M6,Va
Nyauthi DT-G c27-7,Nyauthi DT-G c27-7 C,Star,L (Brown dwarf) Star,1337,14.072144,0.2650451416247304,0.113281,L9,V
Eoch Flyi AA-A h30,Eoch Flyi AA-A h30 A,Star,B (Blue-White) Star,22678,-13.82692,349.00386433932425,62.628906,B4,IVa
Eoch Flyi AA-A h30,Eoch Flyi AA-A h30 B,Star,O (Blue-White) Star,37844,-7.614029,7.174254424155284,21.242188,O8,Vz
Eoch Flyi AA-A h30,Eoch Flyi AA-A h30 C,Star,O (Blue-White) Star,43154,-8.386032,7.871978283249461,25.746094,O6,Vz
Clookuia RD-Q d6-18,Clookuia RD-Q d6-18 A,Star,Neutron Star,2138139,5.201752,1.6428154205607477e-05,0.679688,None,VII
Hypuae Audst OD-B d461,Hypuae Audst OD-B d461 A,Star,F (White) Star,6803,3.665314,1.2332152178289,1.296875,F4,Vb
Hypuae Audst OD-B d461,Hypuae Audst OD-B d461 B,Star,K (Yellow-Orange) Star,4729,6.187775,0.7989806930265996,0.757813,K3,Va
Hypuae Audst OD-B d461,Hypuae Audst OD-B d461 C,Star,M (Red dwarf) Star,3596,8.031982,0.5911254406901509,0.507813,M0,Va
Hypuae Audst OD-B d461,Hypuae Audst OD-B d461 D,Star,K (Yellow-Orange) Star,4753,6.109131,0.8200988526240115,0.800781,K2,Vab
Phua Audst UX-B d264,Phua Audst UX-B d264 A,Star,G (White-Yellow) Star,5390,5.189255,0.9739989302659957,0.953125,G7,Vab
Phua Audst UX-B d264,Phua Audst UX-B d264 B,Star,M (Red dwarf) Star,2865,9.289398,0.5219726355140187,0.347656,M4,Va
Blae Eaec ID-M c10-870,Blae Eaec ID-M c10-870 A,Star,K (Yellow-Orange) Star,4258,6.977341,0.6851500905823149,0.546875,K6,Va
Blae Eaec ID-M c10-870,Blae Eaec ID-M c10-870 B,Star,M (Red dwarf) Star,2707,9.568192,0.5142516865564343,0.347656,M5,Va
IC 2602 Sector RV-J a10-2,IC 2602 Sector RV-J a10-2,Star,L (Brown dwarf) Star,1597,13.200775,0.27746581164629763,0.140625,L5,V
Screakou AN-H c24-1575,Screakou AN-H c24-1575,Star,K (Yellow-Orange) Star,4417,6.536682,0.7799376793673616,0.695313,K5,Va
Pyroo Eohn FM-P c8-0,Pyroo Eohn FM-P c8-0,Star,K (Yellow-Orange) Star,3961,7.380585,0.6575927304097772,0.5625,K8,Va
Pyra Eop VQ-P c8-0,Pyra Eop VQ-P c8-0,Star,M (Red dwarf) Star,3576,8.10347,0.5783996549245147,0.484375,M0,Va
Striechae FM-U b35-0,Striechae FM-U b35-0 A,Star,M (Red dwarf) Star,2867,9.361694,0.5041808655643422,0.289063,M4,Va
Striechae FM-U b35-0,Striechae FM-U b35-0 B,Star,T (Brown dwarf) Star,1202,15.093948,0.20486450611071172,0.082031,T1,V
Striechae FM-U b35-0,Striechae FM-U b35-0 C,Star,M (Red dwarf) Star,2190,11.246109,0.3628844859813084,0.207031,M8,Va
Striechae FM-U b35-0,Striechae FM-U b35-0 D,Star,M (Red dwarf) Star,2062,11.639313,0.34155272465851905,0.179688,M9,VI
Striechae FM-U b35-0,Striechae FM-U b35-0 E,Star,L (Brown dwarf) Star,1445,13.602753,0.28164672322070455,0.117188,L7,V
Bleae Aub LW-N c6-7,Bleae Aub LW-N c6-7 A,Star,K (Yellow-Orange) Star,4351,6.991898,0.651794358015816,0.5625,K5,Vab
Bleae Aub LW-N c6-7,Bleae Aub LW-N c6-7 B,Star,L (Brown dwarf) Star,1842,12.533508,0.28356932278936015,0.148438,L2,V
Bleae Aub LW-N c6-7,Bleae Aub LW-N c6-7 C,Star,L (Brown dwarf) Star,1677,12.712021,0.3151244974838246,0.136719,L4,V
Bleae Aub LW-N c6-7,Bleae Aub LW-N c6-7 D,Star,M (Red dwarf) Star,2593,10.400879,0.3819884859813084,0.246094,M6,Va
Segne HH-S d5-57,Segne HH-S d5-57,Star,G (White-Yellow) Star,5492,4.867554,1.0878905880661394,1.09375,G6,Va
Synuefai DM-Q b52-6,Synuefai DM-Q b52-6 A,Star,M (Red dwarf) Star,3440,8.446014,0.5338439683680806,0.414063,M1,Va
Synuefai DM-Q b52-6,Synuefai DM-Q b52-6 B,Star,M (Red dwarf) Star,2507,10.223175,0.44348144356578,0.289063,M7,Va
Synuefai DM-Q b52-6,Synuefai DM-Q b52-6 C,Star,L (Brown dwarf) Star,1780,12.561981,0.29971310424155284,0.164063,L3,V
Ploxao BX-Q b52-1,Ploxao BX-Q b52-1 A,Star,M (Red dwarf) Star,2595,10.129486,0.43215942487419123,0.292969,M6,Va
Ploxao BX-Q b52-1,Ploxao BX-Q b52-1 B,Star,L (Brown dwarf) Star,1822,12.232269,0.3329467721063983,0.164063,L2,V
Ploxao BX-Q b52-1,Ploxao BX-Q b52-1 C,Star,M (Red dwarf) Star,2842,9.540527,0.4725341308411215,0.289063,M5,Va
Nyauthi KS-I b29-1,Nyauthi KS-I b29-1 A,Star,M (Red dwarf) Star,3245,8.403091,0.6119079568655643,0.394531,M2,Va
Nyauthi KS-I b29-1,Nyauthi KS-I b29-1 B,Star,M (Red dwarf) Star,2669,9.860733,0.4623412911574407,0.28125,M6,Va
Cryaft GP-Z c0,Cryaft GP-Z c0,Star,K (Yellow-Orange) Star,4641,6.122101,0.8550413803019411,0.714844,K3,Va
Pyrie Euq PM-H b37-0,Pyrie Euq PM-H b37-0 A,Star,M (Red dwarf) Star,2647,9.839661,0.47463987347232206,0.300781,M6,Va
Pyrie Euq PM-H b37-0,Pyrie Euq PM-H b37-0 B,Star,T (Brown dwarf) Star,894,16.784164,0.17007444428468727,0.054688,T6,V
Phreia Graae IO-X d2-58,Phreia Graae IO-X d2-58 A,Star,K (Yellow-Orange) Star,4880,5.861649,0.871856586628325,0.8125,K2,Va
Phreia Graae IO-X d2-58,Phreia Graae IO-X d2-58 B,Star,K (Yellow-Orange) Star,3858,7.588013,0.6300353702372394,0.542969,K8,Va
Flyai Phoe RK-B c15-5,Flyai Phoe RK-B c15-5 A,Star,K (Yellow-Orange) Star,4820,6.108475,0.7976989446441409,0.765625,K2,Vab
Flyai Phoe RK-B c15-5,Flyai Phoe RK-B c15-5 B,Star,K (Yellow-Orange) Star,3830,7.797958,0.5803832868439971,0.460938,K9,Va
Flyai Phoe RK-B c15-5,Flyai Phoe RK-B c15-5 C,Star,M (Red dwarf) Star,2070,11.377518,0.38232419841840404,0.210938,M9,VI
Ploi Briae NQ-K b49-9,Ploi Briae NQ-K b49-9 A,Star,M (Red dwarf) Star,3105,8.921097,0.5265197641984184,0.417969,M3,Va
Ploi Briae NQ-K b49-9,Ploi Briae NQ-K b49-9 B,Star,M (Red dwarf) Star,2303,10.700211,0.42190548382458665,0.265625,M8,Va
Dryau Phyloea OL-Y d3410,Dryau Phyloea OL-Y d3410,Star,F (White) Star,7242,3.112396,1.4037170150970524,1.519531,F1,Vb
Schafaei PJ-Y b14-1,Schafaei PJ-Y b14-1 A,Star,M (Red dwarf) Star,2993,9.064255,0.5305175327102803,0.320313,M4,Va
Schafaei PJ-Y b14-1,Schafaei PJ-Y b14-1 B,Star,L (Brown dwarf) Star,1304,14.844833,0.19522093457943926,0.085938,L9,V
Fachiae OB-F c14-0,Fachiae OB-F c14-0,Star,K (Yellow-Orange) Star,3933,7.233521,0.7137145650611071,0.636719,K8,Va
Synuefai QL-D c0,Synuefai QL-D c0,Star,M (Red dwarf) Star,3674,7.511154,0.7197570668583753,0.519531,M0,Va
Tyroosks UY-U c5-2,Tyroosks UY-U c5-2 A,Star,K (Yellow-Orange) Star,3938,7.326721,0.6820067749820273,0.523438,K8,Va
Tyroosks UY-U c5-2,Tyroosks UY-U c5-2 B,Star,M (Red dwarf) Star,2857,9.334167,0.5141906312005752,0.304688,M4,Va
Thuecheae OA-Z b20-12,Thuecheae OA-Z b20-12,Star,M (Red dwarf) Star,3472,8.12558,0.6073608281811647,0.445313,M1,Va
Stuemeae NI-B d7086,Stuemeae NI-B d7086,Star,M (Red dwarf) Star,3187,8.520126,0.6011047016534867,0.421875,M3,Va
Synuefai FU-X c2-0,Synuefai FU-X c2-0 A,Star,T Tauri Star,4624,6.046509,0.8918456592379583,0.746094,TTS3,Va
